标题,区名,小区/位置,几室几厅,面积,朝向,楼层,年份
30W装修南北通两房，税费少，业主诚意卖,闵浦,浦江宝邸北区,2室2厅,78.34平米,南北,低楼层(共14层),2009年建
中间套，飞机户型，三开间朝南，满五年，业主诚心出售,川沙,晨光公寓,3室1厅,89.4平米,南,高楼层(共6层),1995年建
双南通风户型，视野好，诚心出售，交通方便，配套齐全,闵浦,水语人家北苑,2室1厅,78.01平米,南北,低楼层(共14层),2009年建
满五，高区视野开阔，户型好，精装修,陆家嘴,世茂滨江花园,2室2厅,162.63平米,南西,56层,2005年建
新出大三房精装修拎包入住买入价高税费少业主诚意出售,田林,爱建园,3室2厅,144.33平米,南,低楼层(共11层),2004年建
合生财富海景公馆+满五年+拎包入住+价格可谈,金山,合生财富海景公馆,2室2厅,101.28平米,南,高楼层(共23层),2013年建
瑞和新苑新上两房，中间楼层精装修，看房方便拎包入住,闵浦,瑞和新苑浦涛路400弄,2室2厅,73.02平米,南北,中楼层(共6层),2008年建
近地铁22号线＋带电梯+户型好+近百联,金山,合生财富海景公馆,2室2厅,82平米,南,低楼层(共25层),板楼
大平层，南北通，楼层视野采光好，房屋正气，满五,临港新城,临港家园,3室2厅,152.28平米,南北,中楼层(共4层),2007年建
轨交旁-万达旁，居家装修可拎包入住看房方便,金山,御景龙庭,3室2厅,121.47平米,南北,高楼层(共6层),2009年建
近万达，配套齐全，房子精装修，自住保养好,金山,御景龙庭,2室2厅,91.52平米,南,25层,2011年建
楼梯房，满五年，楼层位置好，税费少，业主诚意出售,金山,绿地金卫新家园（东区）,1室2厅,63.51平米,南,高楼层(共6层),2009年建
别墅一排近万达高品质小区好楼层好价格,金山,正荣御首府,3室2厅,111.78平米,南,中楼层(共11层),板楼
一手动迁满五年税少精装修采光通风好诚心出售,川沙,新德路558弄,2室2厅,88.08平米,南,中楼层(共6层),1994年建
全明户型，南北两房，精装修拎包入住，采光无遮挡。,康健,冠生苑,2室1厅,75.32平米,南,高楼层(共6层),1994年建
东礁南北两房高楼层采光充足*税费少,金山,东礁一村,2室1厅,57.32平米,南北,高楼层(共6层),1992年建
业主诚心急售，房源满五少税，视野宽阔，采光足,临港新城,临港家园,2室2厅,93.6平米,南北,高楼层(共4层),2007年建
此房满五，自住精装房。小区中间位置，居住起来舒适。,川沙,银光苑,2室2厅,109.91平米,南,高楼层(共6层),2006年建
精装三房，楼层佳，全家齐居，自由车位，享受别墅风格,临港新城,绿地临港家园（海洋小区）,3室2厅,121.26平米,南北,中楼层(共4层),2007年建
龙泽园五期2室2厅南,金山,龙泽园五期,2室2厅,94.97平米,南,低楼层(共28层),2013年建
3房2厅+居家装修+南北朝向+近万达,金山,绿地金山名邸,3室2厅,88.03平米,南,低楼层(共11层),2014年建
标题,区名,小区/位置,几室几厅,面积,朝向,楼层,年份
地铁22号线，户型方正，配套成熟，看房方便,金山,东礁二村,3室2厅,129.08平米,南北,低楼层(共6层),2003年建
万达绿地双商圈，精装修拎包入住，精装修，舒适大三房,金山,绿地金山名邸,3室2厅,89.42平米,南北,中楼层(共11层),2011年建
挑高客厅带阁楼大露台买一层得2层诚意出售,惠南,博佳花园,4室2厅,125.96平米,南,高楼层(共6层),2004年建
小区中间位置，满五年，两南一北飞机户型，户型全明,金山,辰凯花苑,3室2厅,103平米,南,高楼层(共6层),1998年建
房子精装修，采光充足，带地暖，业主诚意出售,唐镇,鑫唐佳苑,3室2厅,125.55平米,南,高楼层(共6层),2004年建
中高楼层，视野无遮挡，采光通风效果好,金山,君逸公馆,2室1厅,93.1平米,南,高楼层(共18层),2014年建
精装电梯商品房+产权车位+满五税少,金山,御景龙庭,2室2厅,92.61平米,南北,高楼层(共25层),2013年建
金爵置业，带院子，精装修，免个税，品质好，户型正,唐镇,金唐公寓,3室2厅,123.73平米,南,低楼层(共6层),2006年建
此房满五年近地铁，配套齐全，看房方便,唐镇,东唐苑,3室2厅,136.58平米,南,高楼层(共6层),2004年建
满五年税费少采光通风好交通便利业主诚意,潍坊,嘉德公寓,3室2厅,108.32平米,东南,低楼层(共28层),2001年建
品质好房+新南家园满五年双南户型采光好楼层位置俱佳,西渡,新南家园,2室2厅,102.34平米,南,高楼层(共6层),2004年建
鸿宝一村北区，2室2厅1厨1卫，两开间朝南,西渡,鸿宝一村(北区),2室2厅,96.11平米,南,低楼层(共6层),1999年建
海事好房=满五+高楼层+户型方正+通风采光好,临港新城,临港家园,2室2厅,93.96平米,南北,高楼层(共4层),2007年建
近23号地铁双南两房全明户型花园绿茵拎包入住,吴泾,新华小区（龙吴路5599弄）,2室1厅,80.36平米,南,高楼层(共6层),1995年建
电梯双南两房，楼层好，视野开阔，配套成熟，看房方便,金山,东礁一村,2室1厅,77.55平米,南,高楼层(共25层),1996年建
大三房，户型好，楼层佳，业主诚意售,川沙,黄楼花苑,3室1厅,127.34平米,南,中楼层(共5层),2003年建
四房大户型+近万达+物美价廉+小区环境宜人,金山,飞虹南村,4室2厅,142.67平米,南北,中楼层(共6层),1997年建
因为政府核价许多房子外网不展示有需求请咨询我,西渡,文怡花园,3室2厅,106.33平米,南,高楼层(共6层),2004年建
近地铁，精装修可拎包入住，小区环境好,闵浦,浦润苑,2室2厅,78.99平米,南,低楼层(共7层),2012年建
朝南边套安静，高区视野开阔，观陆家嘴三件套，税费少,陆家嘴,久阳滨江公寓,1室1厅,71.15平米,南北,高楼层(共25层),2006年建
辰凯飞机户型大三房+满五年+金山卫+百联+拎包入住,金山,辰凯花苑,3室2厅,103平米,南,6层,1998年建
业主诚心出售，楼层好，视野开阔，采光充足,川沙,御景华庭,3室2厅,138.39平米,南,中楼层(共16层),2013年建
2002年次新房，全明户型，小区中间位置，配套齐全,川沙,华盛名门,2室2厅,113.71平米,南,中楼层(共11层),2001年建
中间楼层户型方正的大三房通风采光好,川沙,新川苑,3室1厅,129平米,南北,低楼层(共6层),2000年建
品质好房：黄浦江尽收眼底，西渡地铁口，满五年税费少,西渡,水帘洞小区,3室1厅,105.06平米,西,高楼层(共6层),1996年建
"满五年,南北通格局,13年电梯商品房精装修拎包入住",川沙,象屿鼎城(公寓),3室2厅,118.68平米,南,低楼层(共9层),2013年建
房子满五年，位置好，落地阳台，户型方正，诚心出售。,西渡,金都雅苑,3室2厅,109.02平米,南,高楼层(共6层),2005年建
宜浩电梯大三房满五税少产权清晰诚心出售,临港新城,宜浩佳园,3室2厅,130.59平米,南北,低楼层(共12层),2009年建
店长主推好房，沿河景观房，业主自住装修全屋地暖,临港新城,万科金域澜湾,3室2厅,89.97平米,东南,中楼层(共8层),2019年建
买入价高税费少，二改三飞机户型，自住装修采光无遮挡,张江,张江汤臣豪园(三期),2室1厅,89.25平米,南,低楼层(共12层),2010年建
标题,区名,小区/位置,几室几厅,面积,朝向,楼层,年份
双南大两房，采光佳，视野宽阔，满五，房东诚意出售,老闵行,沧源小区,2室2厅,91.61平米,南北,高楼层(共6层),1998年建
"满五年,南北通格局,13年电梯商品房精装修拎包入住",川沙,象屿鼎城(公寓),3室2厅,118.68平米,南,低楼层(共9层),2013年建
金山新城区+精装三房+视野开阔+采光充足,金山,新城旭辉府,3室2厅,88平米,南,高楼层(共18层),板楼
此房满五年，税费少，产权清晰，诚心出售！拎包入住！,临港新城,宜浩佳园,1室2厅,75.95平米,南北,中楼层(共4层),2009年建
业主急售西边套大平层，三开间朝南，视野前后无遮挡,临港新城,滴水湖馨苑三期,3室2厅,117.07平米,南北,低楼层(共11层),暂无数据
沙田公寓税费少近地铁配套丰富诚意出售,川沙,沙田公寓,3室2厅,87.71平米,南,高楼层(共6层),1994年建
买入价高税费少，二改三飞机户型，自住装修采光无遮挡,张江,张江汤臣豪园(三期),2室1厅,89.25平米,南,低楼层(共12层),2010年建
宜浩电梯大三房满五税少产权清晰诚心出售,临港新城,宜浩佳园,3室2厅,130.59平米,南北,低楼层(共12层),2009年建
店长主推好房，沿河景观房，业主自住装修全屋地暖,临港新城,万科金域澜湾,3室2厅,89.97平米,东南,中楼层(共8层),2019年建
别墅小区商品房，环境很好，楼间距开阔，自贸区，急售,奉贤金汇,天和尚上海,3室2厅,88.12平米,南北,高楼层(共23层),板楼
房子满五年，位置好，落地阳台，户型方正，诚心出售。,西渡,金都雅苑,3室2厅,109.02平米,南,高楼层(共6层),2005年建
位置好，采光好，满五年，交通便利,西渡,新南家园,3室2厅,144.96平米,南,低楼层(共6层),2005年建
森兰精装修2房、紧急出售、近地铁6号、12号线！,高行,东沟四村,2室1厅,59.21平米,南,高楼层(共6层),1994年建
张江科学城双子塔+近地铁+大三房+采光充足+临河位置,张江,春港丽园(公寓),3室2厅,116.17平米,南,高楼层(共6层),2000年建
有车位，高楼层，精致两房错过可惜,金山,万达华府,2室2厅,86.84平米,南,高楼层(共32层),2015年建
万达商圈+飞机全明户型+三房两卫+满五年税费少,金山,海趣馨苑,3室2厅,117.39平米,南,高楼层(共6层),2005年建
首付15万+22号线城际轨交+近万达+小区环境安静清新,金山,滨海二村,2室1厅,51.49平米,南,中楼层(共6层),1986年建
好地段好户型好价格好房东好位置好物业,金山,万盛金邸,3室2厅,107.23平米,南,高楼层(共14层),2013年建
金山新城区+2015年次新房品质小区+精装修拎包入住,金山,新城旭辉府,3室2厅,88.48平米,南北,低楼层(共11层),板楼
满五无个税南北两房一梯两户视野宽阔采光充足,长风,金玉苑（二期）,2室2厅,114平米,南,高楼层(共6层),2000年建
此房住宅产权，单价低，新装修，楼层好，交通便利,陆家嘴,汤臣商务中心,1室2厅,62.11平米,东,25层,1999年建
户型好，位置好，近地铁，生活方便。,川沙,新德五村,2室1厅,59.66平米,南,高楼层(共6层),1994年建
临河小户型+户型方正+一手动迁,唐镇,唐丰苑,1室1厅,58.59平米,南,低楼层(共14层),2014年建
诚意出售+户型方正+中间楼层不靠路,唐镇,齐爱佳苑,1室1厅,50.59平米,南,中楼层(共6层),2008年建
满五年，中间楼层，看房方便，提前联系,老闵行,星河景苑,1室1厅,59.14平米,南,中楼层(共14层),2006年建
2020年次新小区，品牌小区，小区环境好，人车分流,临港新城,东宸源著,3室2厅,92.77平米,南北,低楼层(共8层),板楼
此房满五，南北通透，电梯顶复，高区景观可观东方明珠,大华,馨华苑,6室3厅,194.47平米,南北,高楼层(共11层),2001年建
次顶楼，视野好，精装修，采光好,临港新城,朗诗里程,2室2厅,77.73平米,南北,高楼层(共15层),板楼
新江湾时代花园2室2厅南,新江湾城,新江湾时代花园,2室2厅,87.24平米,南,中楼层(共5层),2000年建
住宅产权，随时看房，精装修，业主诚意出售..,陆家嘴,汤臣商务中心,3室2厅,169.19平米,南,28层,1997年建
标题,区名,小区/位置,几室几厅,面积,朝向,楼层,年份
国企开发2013次新房一线江景带全屋地暖人车分流,塘桥,国信世纪海景,3室2厅,202.11平米,南,低楼层(共35层),2012年建
金山必买户型，大三房，精装修，小区配套好,金山,飞虹北村,3室2厅,125.41平米,南,高楼层(共6层),2008年建
小区人车分流，双会所带恒温游泳池，一梯一户高区景观,新江湾城,华润置地橡树湾,4室2厅,267.86平米,南,高楼层(共13层),2010年建
满五年+毛坯房+业主诚心出售+看房方便,柘林,海韵馨苑,3室2厅,130.39平米,南,中楼层(共5层),2009年建
金山精装小房子，品质小区，看房方便,金山,御景龙庭,1室2厅,62.82平米,南,中楼层(共18层),2011年建
新上一房，5年新装修高区采样好，拎包入住,静安新城,九歌上郡,1室1厅,55.16平米,南,高楼层(共11层),2006年建
15年模范小区房源。精装修，视野好。,田林,田林十二村,1室0厅,41.22平米,南,高楼层(共6层),1985年建
原始动迁无增值税精装房南北通透交通便利,闵浦,瑞和华苑北区,2室2厅,80.52平米,南北,低楼层(共11层),2013年建
两房朝南，空间大，诚心出售，繁华配套,川沙,妙境路395弄,2室1厅,76.81平米,南,低楼层(共6层),1994年建
满五年税少两房，无增值税及个税，看房方便,川沙,园西小区,2室1厅,57.83平米,南北,低楼层(共6层),1989年建
高品质小区，安全方便，温馨小窝，独享一片空间~,老闵行,当代万国府MOMA,1室1厅,48.84平米,南北,低楼层(共17层),2017年建
临港主城区，满五年户型方正，精装修，诚心出售,临港新城,绿地蓝海庭,1室1厅,52.54平米,南,中楼层(共5层),2009年建
内环内近地铁满5V1+税费少+精装修,潍坊,东建新村,2室0厅,47.72平米,南,高楼层(共6层),1976年建
户型方正全明户型税费少业主诚意出售,川沙,华沙一村,2室1厅,75.92平米,南,高楼层(共5层),1994年建
中间楼层满五年税费少临河景观房总价少诚心出售,唐镇,金利公寓,1室1厅,54.36平米,南,低楼层(共6层),2008年建
张江科学城双子塔，广兰路，房型正，精装修，满五年，,张江,中芯花园199弄,2室1厅,65.9平米,南北,高楼层(共6层),2005年建
此房满五年，看房只能周末，需要提前约,田林,田林五六七村,1室1厅,40.81平米,南,高楼层(共6层),1982年建
自贸区林海公路中间楼层南北通透班车接驳8号线,奉贤金汇,天和尚上海,2室2厅,76.08平米,南北,中楼层(共29层),板楼
着急出售配套好交通方便地铁近合适老人小孩居住环境好,川沙,顺馨佳园,2室1厅,88.47平米,南,低楼层(共6层),2009年建
临港低密度小区、南北户型、次新房中楼层，业主诚售。,书院镇,东方颐城,2室2厅,82.85平米,南北,中楼层(共7层),暂无数据
海上风华，品质小区，叠加别墅实用性高,临港新城,海上风华,3室2厅,90.76平米,南北,中楼层(共5层),板楼
难得的小三房户型+总价低税费少,金山,飞虹南村,3室1厅,76.82平米,南,高楼层(共6层),1995年建
锦佳苑3室2厅南,大宁,锦佳苑,3室2厅,92.18平米,南,6层,1997年建
河景房，次新小区，品牌小区，小区环境优美，人车分流,临港新城,东宸源著,3室2厅,92.85平米,南北,中楼层(共8层),2020年建
房龄新精装修，方正户型，诚意售房，看房方便,临港新城,万科金域澜湾鹭语墅,2室2厅,80.88平米,南北,低楼层(共8层),板楼
店长推荐好房源，正南格局，无遮挡采光好，户型方正,临港新城,海上风华,3室2厅,90.1平米,南北,低楼层(共8层),2020年建
万达新城区域，总价低，业主诚意，满五年，首付43万。,金山,绿地金卫新家园（西区）,1室2厅,78.12平米,南,高楼层(共6层),2007年建
浦发精装修，两房两厅两卫，全新房，诚意出售,唐镇,浦发罗兰翡丽,2室2厅,97.02平米,南北,低楼层(共18层),板楼
低总价！户型方正！自住养老好选择！,金山,滨海二村,2室1厅,51.65平米,南,高楼层(共6层),1986年建
业主诚意看房方便带空中花园,新华路,佳信都市花园(公寓),7室2厅,261.11平米,南,高楼层(共16层),1998年建
标题,区名,小区/位置,几室几厅,面积,朝向,楼层,年份
8号线电梯一居室中楼层采光充足,西藏北路,复元坊,1室1厅,57.69平米,南,中楼层(共20层),1994年建
三轨交，满五年电梯大两房，户型方正，有车位,万体馆,明佳苑,2室2厅,116.79平米,南北,低楼层(共24层),1998年建
花木北蔡+地铁7号线13号线+龙阳CBD,北蔡,天池二村,1室1厅,46.2平米,南,高楼层(共6层),1994年建
带阁楼，动迁无增值税，三房二卫，通风采光好。,川沙,舒馨北苑,3室2厅,118.89平米,南,高楼层(共6层),2007年建
近地铁中间楼层房龄较新1梯2户,川沙,妙城公寓,2室2厅,119.21平米,南北,中楼层(共6层),2000年建
装修新，贴近小区公园，总价低，不靠马路不靠主路,临港新城,宜浩佳园,1室2厅,74.67平米,南北,低楼层(共4层),2009年建
房子一般装修户型方正看房方便诚心出售,临港新城,绿地临港家园（海洋小区）,2室2厅,75.07平米,南北,低楼层(共4层),2007年建
金山新城区，次新房，带产权车位，满五年，精装修，,金山,君逸公馆,2室2厅,96平米,南,高楼层(共18层),2014年建
中间楼层，临港主城区内，南北通户型，采光好,临港新城,绿地临港家园（海洋小区）,2室2厅,83.53平米,南,中楼层(共4层),2007年建
房子是满五年免个税，近闸北公园，久光百货地铁1/8线,闸北公园,平型关路235弄,2室1厅,61.52平米,南北,高楼层(共6层),1987年建
长寿公园旁全明3房满五年地铁口自住装修,长寿路,云都苑,3室1厅,124.77平米,西南,中楼层(共24层),1999年建
单价低，全南户型，采光良好，大三房,杨行,康桥水都(公寓),3室1厅,130.8平米,南,高楼层(共6层),2005年建
经典、精致明亮大三房、光照十足、双卫户型,杨行,康桥水都(公寓),3室2厅,130.8平米,南,高楼层(共6层),2005年建
近地铁，户型大，有额外面积，税费少，适合自住,老闵行,昆阳小区,3室2厅,76.92平米,南,高楼层(共5层),1973年建
房子满五年，税费少，采光好，次新电梯房,白鹤,绿地时代名邸,2室2厅,84.5平米,南,中楼层(共22层),2015年建
本房满五年名下一套，业主诚售，费用少，产权清晰,鞍山,鞍山四村第一小区,1室1厅,37.44平米,南,高楼层(共6层),1979年建
建德国际公寓2室2厅南,新江湾城,建德国际公寓,2室2厅,107.81平米,南,低楼层(共11层),2007年建
地铁口大两房，一手动迁，户型方正，楼层好，业主诚意,春申,虹景苑,2室2厅,100.16平米,南,中楼层(共6层),2001年建
高区精装修，采光好视野开阔，满五年，交通便利。,长风,桂巷新村,3室0厅,64.56平米,东南,高楼层(共17层),1985年建
用心选房：此房是售后公房，满五且一套，得房率高,康健,上海师大新村,3室1厅,68.6平米,南,高楼层(共6层),1993年建
此房满5唯1，配备齐全，生活便利,金汇,金坤花园,1室0厅,30平米,南西,高楼层(共6层),2002年建
飞机户型大错层+满五年+电梯房前面无遮挡+挑高高一些,松江新城,绿洲华庭苑(公寓),4室2厅,190.61平米,南,中楼层(共11层),2003年建
14号线嘉怡路地铁口50米，精装修3房，高品质小区,江桥,天际蓝桥,3室2厅,135.08平米,南,低楼层(共17层),2010年建
M五W一，全明户型，优质楼层，采光优良。,大宁,永乐苑,2室2厅,110.97平米,南,6层,1999年建
金山新城区，电梯洋房，精装修，品质小区，物业好,金山,新城旭辉府,3室2厅,88.37平米,南,低楼层(共7层),2015年建
02年复式大平层满五年买进价高税费少精装修50平阳光房,张庙,呼玛五村,6室3厅,225.16平米,南北,高楼层(共6层),2002年建
诚意出售，南北通，一梯两户，得房率高的适用三房,大宁,心族公寓,3室2厅,88.76平米,南,低楼层(共6层),1996年建
精装大三房，满五税费少，交通便利,虹桥,虹景花苑,3室2厅,154.75平米,东南,低楼层(共7层),1998年建
谈家桥路163弄2室1厅南,大宁,谈家桥路163弄,2室1厅,52.64平米,南,高楼层(共6层),1985年建
保辉南北直通三房，装修保养好，采光无遮挡,新江湾城,保辉香景园,3室2厅,155.04平米,南,低楼层(共17层),2012年建
标题,区名,小区/位置,几室几厅,面积,朝向,楼层,年份
总价低，满五年税费少，带露台。,莘闵别墅,丽水华庭,4室2厅,146.98平米,南,4层,2004年建
[总监力荐]星梅花苑南北通小两房高品质精装修带天井,长风,星梅花苑,2室1厅,49.19平米,南,低楼层(共6层),1994年建
内环内05年电梯小户型，全明多面采光，满五年税费低,不夜城,天道俪晶国际公寓,1室1厅,59.33平米,东东南北,低楼层(共31层),2004年建
满五年税费少，全南户型采光好看房方便近地铁,控江路,城市丽园,2室2厅,100.33平米,南,中楼层(共17层),2005年建
南北通，双卫双阳台，精装修拎包入住,真如,星河世纪城,2室2厅,114.59平米,南,低楼层(共24层),2008年建
香榭苑三期正气大三房采光充足中间位置，花园小区,龙柏,龙柏香榭苑,3室2厅,134.06平米,南,低楼层(共11层),2002年建
新上1室1厅+户型方正采光视野无遮挡+1梯2户得房率高,大宁,锦佳苑,1室1厅,51.46平米,西,6层,1997年建
满五年+采光好+双轨交通+成熟配套,周家嘴路,华升新苑,3室2厅,115.06平米,南北,低楼层(共17层),2001年建
内环内顶层复式，带露台，四开间朝南，厅南北通，满五,不夜城,北美公寓,4室3厅,168.08平米,北南,高楼层(共6层),2002年建
大两房，中高楼层，边套全明户型，一梯两户。,植物园,天龙苑,2室1厅,78.86平米,南,高楼层(共6层),1999年建
一南一北两房，全明功能间格局，宜居装饰,长风,梅六小区,2室1厅,55.23平米,南北,低楼层(共6层),1994年建
"14号线,地铁口,低密度社区，电梯中区，满五年，诚售！",丰庄,逸香园,4室2厅,155.66平米,南北,中楼层(共10层),2004年建
内环内，精装两房，二手买进满五，单价低总价低,武宁,锦绿新城,2室2厅,72.48平米,东西,低楼层(共6层),1999年建
品质好房+近地铁站+高档小区+两梯两户+边套+诚心出售,西渡,中国铁建香榭国际,4室2厅,123.27平米,南,中楼层(共20层),2018年建
临港新片区，品质小区，毛坯两房，高楼无遮，诚心出售,书院镇,东方颐城,2室2厅,82.85平米,南,中楼层(共7层),暂无数据
此房满五产权清晰无户口无贷款产证一个人名字,西渡,鸿吉苑,2室1厅,57.68平米,南,高楼层(共6层),1999年建
金山新城区，品质小区，电梯洋房，精装修,金山,新城旭辉府,3室2厅,88平米,南,低楼层(共8层),2015年建
房龄新，景观好，南北通，采光好,临港新城,万科金域澜湾,3室1厅,90.57平米,南,高楼层(共8层),2018年建
原动迁，南北。通双阳台户型，通风采光好，诚心出售,闵浦,瑞和华苑北区,2室2厅,80.52平米,南北,低楼层(共11层),2013年建
精装修近万达楼层好业主诚意出售,金山,绿地金卫新家园（东区）,1室2厅,64.82平米,南,中楼层(共5层),2007年建
次新房+栋距大+紧凑3房+自住考虑长期持有待价均适宜,临港新城,滴水湖馨苑四期,3室2厅,87.32平米,北,低楼层(共8层),2018年建
临港自贸区，小区班车可达8号线,奉贤金汇,天和尚上海,3室2厅,93平米,南北,低楼层(共25层),板楼
南北通透+高楼层+视野开阔+采光充足,万里,愉景华庭,6室3厅,248.48平米,南北,高楼层(共19层),2005年建
户型方正大两房+毛坯易改动+满五税费少,临港新城,临港家园,2室2厅,99.34平米,北南,中楼层(共4层),暂无数据
次新房小区，两梯两户，边套户型，诚意出售,浦江,浦江坤庭—枫郡,2室2厅,124.58平米,南,低楼层(共16层),板楼
朝南杨浦公园旁边楼层好业主诚心出售,控江路,控江路888弄,1室1厅,40.49平米,南,中楼层(共5层),1972年建
满五，南电梯房，双南中特正气的户型，电梯，无遮挡,康健,寿祥坊,2室1厅,99.69平米,南,低楼层(共18层),1996年建
高层飞机户型小三房，视野开阔采光好,九亭,象屿品城,3室1厅,90.99平米,南,高楼层(共11层),2015年建
视野好，健身楼层，诚意出售，双南户型,华东理工,陇南小区,2室1厅,69.08平米,南,高楼层(共7层),1994年建
大区同事吐血推荐，飞机户型，精装修，位置好,春申,银泰苑,3室2厅,133.85平米,南,低楼层(共10层),2011年建
标题,区名,小区/位置,几室几厅,面积,朝向,楼层,年份
双南两房，宽敞明亮，中间楼层。,洋泾,崮山小区三街坊,2室1厅,70.21平米,南,中楼层(共6层),1997年建
氯碱低总价两房，采光好，业主诚意出售,吴泾,氯碱小区,2室1厅,53.09平米,南,高楼层(共6层),1988年建
近地铁，朝南，通透，电梯高层视野开阔，拎包入住。,真如,车站新村(普陀),1室2厅,59.41平米,南,高楼层(共18层),1993年建
l临港主城区南北通透满五年楼层好采光足视野宽阔,临港新城,绿地东岸涟城,2室1厅,86.23平米,南北,高楼层(共5层),2009年建
全新精装，从未居住，采光好，通风好，精选好房推荐,梅园,巨杨小区,2室1厅,53.06平米,南,高楼层(共6层),1992年建
新上笋盘，经典一室户，中间好楼层，精装修,长风,芝巷小区,1室0厅,31.73平米,西,中楼层(共6层),1995年建
【城中花园】地铁18号线，景观视野，满五，地暖，通透,康桥,城中花园,2室2厅,97.64平米,南,中楼层(共11层),2005年建
定边路地铁口+精装修+配套齐全+交通便,丰庄,金鼎香樟苑(西区),2室2厅,91.72平米,南,高楼层(共18层),2012年建
